{
  "eventId": "evt_01K4Q0N7S6Z2X8G5H3J9M1P7RA",
  "eventType": "travel.trip.cancellation-incomplete",
  "eventVersion": 1,
  "occurredAt": "2026-09-09T20:11:52Z",
  "tenantId": "acme",
  "correlationId": "trip_01K4Q0N7S6Z2X8G5H3J9M1P7RB",
  "causationId": "cmd_01K4Q0N7S6Z2X8G5H3J9M1P7RC",
  "producer": "travel-core",
  "data": {
    "tripId": "trip_01K4Q0N7S6Z2X8G5H3J9M1P7RB",
    "orderId": "ord_01K4Q0N7S6Z2X8G5H3J9M1P7RD",
    "reasonCode": "CANCELLATION_INCOMPLETE",
    "message": "hotel Wilshire Non-Refundable refused the cancellation; a person is handling the exposure"
  }
}
