{
  "eventId": "evt_01K4Q0N7S6Z2X8G5H3J9M1P7S1",
  "eventType": "travel.disruption.detected",
  "eventVersion": 1, "occurredAt": "2026-09-13T14:05:12Z", "tenantId": "acme", "correlationId": "trip_01K4Q0N7S6Z2X8G5H3J9M1P7RB",
  "causationId": "sbx-evt-000123",
  "producer": "supplier-gateway",
  "data": {"disruptionId":"dsr_01K4Q0N7S6Z2X8G5H3J9M1P7RD","type":"FLIGHT_CANCELLED","supplier":"sandbox-air","supplierEventId":"sbx-evt-000123","externalOrderId":"SBX-01K4Q0N7S6Z2X8G5H3J9M1P7RH","recordLocator":"TM3KA6","detectedAt":"2026-09-13T14:05:11Z","severity":"HIGH","rawReference":"sandbox-air/notices/000123","reason":"Flight DL240 cancelled: crew availability","affected":{"segmentId":"DL240-BOS","carrier":"DL","flightNumber":"DL240","origin":"BOS","destination":"SEA","scheduledDeparture":"2026-10-06T10:00:00Z","scheduledArrival":"2026-10-06T16:20:00Z"}}
}
