{
  "eventId": "evt_01K4Q0N7S6Z2X8G5H3J9M1P7RP",
  "eventType": "travel.trip.purchase-authorized",
  "eventVersion": 1,
  "occurredAt": "2026-09-09T20:11:52Z",
  "tenantId": "acme",
  "correlationId": "trip_01K4Q0N7S6Z2X8G5H3J9M1P7RB",
  "causationId": "cmd_01K4Q0N7S6Z2X8G5H3J9M1P7RC",
  "producer": "travel-core",
  "data": {
    "tripId": "trip_01K4Q0N7S6Z2X8G5H3J9M1P7RB",
    "authorizationId": "pau_01K4Q0N7S6Z2X8G5H3J9M1P7RG",
    "basis": "HUMAN",
    "bundleId": "bdl_01K4Q0N7S6Z2X8G5H3J9M1P7RD",
    "total": {
      "currency": "USD",
      "amountMinor": 82000
    },
    "authorizedBy": "human/alice",
    "policyDecisionId": "pd_01K4Q0N7S6Z2X8G5H3J9M1P7RF",
    "expiresAt": "2026-09-09T20:41:52Z"
  }
}